{
  "$schema": "https://json-schema.org/draft/2020-12/schema",
  "title": "ObservabilitySummaryResponse",
  "type": "object",
  "properties": {
    "total_traces": {
      "type": "integer"
    },
    "executed_count": {
      "type": "integer"
    },
    "executed_with_controls_count": {
      "type": "integer"
    },
    "blocked_count": {
      "type": "integer"
    },
    "blocked_pending_approval_count": {
      "type": "integer"
    },
    "total_token_estimate": {
      "type": "integer"
    },
    "total_estimated_cost_usd": {
      "type": "number"
    },
    "agents_observed": {
      "type": "array",
      "items": {
        "type": "string"
      }
    },
    "provider_usage": {
      "type": "object"
    },
    "policy_decisions": {
      "type": "object"
    },
    "recent_blocked_actions": {
      "type": "array"
    }
  }
}
